product_id,reviewText,overall,verified_purchase,helpful_votes,reviewer_review_count
B07XJ8C8F5,"Amazing sound quality! The bass is deep and clear. Battery lasts 28 hours easily. Very comfortable for long listening sessions.",5,1,12,3
B07XJ8C8F5,"Decent earphones for the price. Sound is ok but not exceptional. Build feels a bit cheap.",3,1,2,8
B07XJ8C8F5,"Battery died after 6 months. Very disappointed with the durability. Not worth the money.",1,1,5,2
B08N5WRWNW,"Crystal clear audio and great noise cancellation. The price is a bit high but worth every penny.",5,1,20,1
B08N5WRWNW,"Good product overall. Camera quality on the connected app is average. Delivery was fast.",4,0,0,45
B09B8YWXDF,"Comfortable fit, good sound. Nothing special but solid value for the price.",4,1,3,6
